{
  "$schema": "../schemas/subdomains.schema.json",
  "version": "1.0.0",
  "domain": "rjmlaird.co.uk",
  "updated": "2026-10-14",
  "subdomains": [
    {
      "slug": "web",
      "hostname": "rjmlaird.co.uk",
      "title": "Main site",
      "purpose": "Main public site for the rjmlaird.co.uk brand and content",
      "classification": "website",
      "visibility": "public",
      "lifecycle": "active",
      "evidence": "owner-stated",
      "documentation": "catalogue/first-party/web.md",
      "publish": true,
      "status": null,
      "health": null,
      "repository": null
    },
    {
      "slug": "docs",
      "hostname": "docs.rjmlaird.co.uk",
      "title": "Documentation",
      "purpose": "Public documentation for the digital estate",
      "classification": "documentation",
      "visibility": "public",
      "lifecycle": "active",
      "evidence": "repository",
      "documentation": "catalogue/first-party/docs.md",
      "publish": true,
      "status": null,
      "health": null,
      "repository": null
    },
    {
      "slug": "data",
      "hostname": "data.rjmlaird.co.uk",
      "title": "Reference data",
      "purpose": "Curated, attributed public reference-data API",
      "classification": "data",
      "visibility": "public",
      "lifecycle": "planned",
      "evidence": "none",
      "documentation": "catalogue/first-party/data.md",
      "publish": true,
      "status": null,
      "health": null,
      "repository": null
    },
    {
      "slug": "api",
      "hostname": "api.rjmlaird.co.uk",
      "title": "Public API",
      "purpose": "Public, read-oriented portfolio and estate catalogue API",
      "classification": "api",
      "visibility": "public",
      "lifecycle": "planned",
      "evidence": "owner-stated",
      "documentation": "catalogue/first-party/api.md",
      "publish": true,
      "status": null,
      "health": null,
      "repository": null
    },
    {
      "slug": "status",
      "hostname": "status.rjmlaird.co.uk",
      "title": "Status",
      "purpose": "Curated public service-status reporting",
      "classification": "status",
      "visibility": "public",
      "lifecycle": "planned",
      "evidence": "none",
      "documentation": "catalogue/first-party/status.md",
      "publish": true,
      "status": null,
      "health": null,
      "repository": null
    },
    {
      "slug": "cdn",
      "hostname": "cdn.rjmlaird.co.uk",
      "title": "Asset delivery",
      "purpose": "Public, read-only delivery of approved assets",
      "classification": "asset-delivery",
      "visibility": "public",
      "lifecycle": "planned",
      "evidence": "none",
      "documentation": "catalogue/first-party/cdn.md",
      "publish": true,
      "status": null,
      "health": null,
      "repository": null
    },
    {
      "slug": "dam",
      "hostname": "dam.rjmlaird.co.uk",
      "title": "Asset management",
      "purpose": "Governed media and asset management",
      "classification": "asset-management",
      "visibility": "restricted",
      "lifecycle": "planned",
      "evidence": "none",
      "documentation": "catalogue/first-party/dam.md",
      "publish": true,
      "status": null,
      "health": null,
      "repository": null
    },
    {
      "slug": "upload",
      "hostname": "upload.rjmlaird.co.uk",
      "title": "Upload",
      "purpose": "Controlled content and asset ingestion",
      "classification": "ingestion",
      "visibility": "restricted",
      "lifecycle": "planned",
      "evidence": "none",
      "documentation": "catalogue/first-party/upload.md",
      "publish": true,
      "status": null,
      "health": null,
      "repository": null
    },
    {
      "slug": "dev",
      "hostname": "dev.rjmlaird.co.uk",
      "title": "Developer resources",
      "purpose": "Reserved for developer-facing resources and release workflow",
      "classification": "developer",
      "visibility": "public",
      "lifecycle": "reserved",
      "evidence": "none",
      "documentation": "catalogue/first-party/dev.md",
      "publish": true,
      "status": null,
      "health": null,
      "repository": null
    },
    {
      "slug": "apps",
      "hostname": "apps.rjmlaird.co.uk",
      "title": "Apps catalogue",
      "purpose": "Catalogue and presentation layer for maintained applications",
      "classification": "catalogue",
      "visibility": "public",
      "lifecycle": "planned",
      "evidence": "none",
      "documentation": "catalogue/first-party/apps.md",
      "publish": true,
      "status": null,
      "health": null,
      "repository": null
    },
    {
      "slug": "tools",
      "hostname": "tools.rjmlaird.co.uk",
      "title": "Tools catalogue",
      "purpose": "Catalogue and presentation layer for reusable utilities",
      "classification": "catalogue",
      "visibility": "public",
      "lifecycle": "planned",
      "evidence": "none",
      "documentation": "catalogue/first-party/tools.md",
      "publish": true,
      "status": null,
      "health": null,
      "repository": null
    },
    {
      "slug": "labs",
      "hostname": "labs.rjmlaird.co.uk",
      "title": "Labs",
      "purpose": "Experimental and exploratory work, separate from production apps and tools",
      "classification": "experimental",
      "visibility": "public",
      "lifecycle": "active",
      "evidence": "linked",
      "documentation": "catalogue/first-party/labs.md",
      "publish": true,
      "status": null,
      "health": null,
      "repository": null
    },
    {
      "slug": "auth",
      "hostname": "auth.rjmlaird.co.uk",
      "title": "Identity and access",
      "purpose": "Identity and access boundary for protected services",
      "classification": "identity",
      "visibility": "restricted",
      "lifecycle": "planned",
      "evidence": "owner-stated",
      "documentation": "catalogue/first-party/auth.md",
      "publish": true,
      "status": null,
      "health": null,
      "repository": null
    },
    {
      "slug": "mcp",
      "hostname": "mcp.rjmlaird.co.uk",
      "title": "MCP service",
      "purpose": "Model Context Protocol service for approved AI clients",
      "classification": "protocol",
      "visibility": "restricted",
      "lifecycle": "planned",
      "evidence": "none",
      "documentation": "catalogue/first-party/mcp.md",
      "publish": true,
      "status": null,
      "health": null,
      "repository": null
    },
    {
      "slug": "hooks",
      "hostname": "hooks.rjmlaird.co.uk",
      "title": "Webhook gateway",
      "purpose": "Verified inbound webhook gateway",
      "classification": "integration",
      "visibility": "restricted",
      "lifecycle": "planned",
      "evidence": "owner-stated",
      "documentation": "catalogue/first-party/hooks.md",
      "publish": true,
      "status": null,
      "health": null,
      "repository": null
    },
    {
      "slug": "booking",
      "hostname": "booking.rjmlaird.co.uk",
      "title": "Booking",
      "purpose": "Booking integration boundary",
      "classification": "integration",
      "visibility": "public",
      "lifecycle": "planned",
      "evidence": "none",
      "documentation": "catalogue/first-party/booking.md",
      "publish": true,
      "status": null,
      "health": null,
      "repository": null
    },
    {
      "slug": "dav",
      "hostname": "dav.rjmlaird.co.uk",
      "title": "WebDAV storage",
      "purpose": "Private WebDAV attachment storage for Zotero",
      "classification": "storage",
      "visibility": "restricted",
      "lifecycle": "planned",
      "evidence": "owner-stated",
      "documentation": "catalogue/first-party/dav.md",
      "publish": true,
      "status": null,
      "health": null,
      "repository": null
    },
    {
      "slug": "master",
      "hostname": null,
      "title": "Master (control plane)",
      "purpose": "Canonical manifests and control-plane role; a concept, not a deployed hostname",
      "classification": "control-plane",
      "visibility": "public",
      "lifecycle": "planned",
      "evidence": "none",
      "documentation": "catalogue/first-party/master.md",
      "publish": true,
      "status": null,
      "health": null,
      "repository": null
    },
    {
      "slug": "billing",
      "hostname": "billing.rjmlaird.co.uk",
      "title": "Billing",
      "purpose": "Checkout-session creation for paid services",
      "classification": "integration",
      "visibility": "public",
      "lifecycle": "planned",
      "evidence": "none",
      "documentation": null,
      "publish": true,
      "status": null,
      "health": null,
      "repository": null
    },
    {
      "slug": "research",
      "hostname": "research.rjmlaird.co.uk",
      "title": "Research",
      "purpose": "Research, essays and analysis",
      "classification": "website",
      "visibility": "public",
      "lifecycle": "planned",
      "evidence": "none",
      "documentation": null,
      "publish": true,
      "status": null,
      "health": null,
      "repository": null
    },
    {
      "slug": "space",
      "hostname": "space.rjmlaird.co.uk",
      "title": "Space",
      "purpose": "Space and astronomy hub",
      "classification": "website",
      "visibility": "public",
      "lifecycle": "planned",
      "evidence": "none",
      "documentation": null,
      "publish": true,
      "status": null,
      "health": null,
      "repository": null
    }
  ]
}
